<!DOCTYPE dataset SYSTEM "../../../../../test.dtd">

<dataset>

    <SETTINGST ID="2" />
    <SETTINGST ID="9" />
    <SETTINGST ID="10" />

    <!-- Encrypted password corresponds to the "ahoj2" -->
    <USERT ID="111111112" EMAIL="velislav@email.com" PASSWORD="2ScrHmE5/qPHYSsYljrBNsMndlJLrvD5mWX+UkfTw2/GnAZsK77M6Cv9j9+WKNxB"
           SETTINGS_ID="2" ENABLED="1" VERIFICATION="VERIFIED" />
    <BUSINESSUSERDATA ID="111111112" COMPANYNAME="My Second Company" PERSONFIRSTNAME="Velislav" PERSONLASTNAME="Kroko"
                      CURRENTCREDITS="30" ENABLED="1"/>
    <BUSINESSUSER  ID="111111112" BUSINESSUSERDATA_ID="111111112"/>
    <BUSINESSUSERROLE ID="111111121" BUSINESSUSER_ID="111111112" ENABLED="1"/>
    <CLIENT ID="111111121" />


    <!-- external user that has pending notification (older than 30 days) -->
    <USERT ID="111111119" EMAIL="imported4@email.com" PASSWORD="ktWVVhGwWiMsAVgfbIZmX96r5WXBwIzMcGzwUBVAXcFvtiJutGRbKOk58TfQ4Wr2"
           SETTINGS_ID="9" ENABLED="1" VERIFICATION="UNVERIFIED" />
    <USERT_ACCESSROLE USERT_ID="111111119" ACCESSROLES_ID="2" />
    <BUSINESSUSERDATA ID="111111119" COMPANYNAME="My Fourth Company" PERSONFIRSTNAME="Imported" PERSONLASTNAME="User2"
                      TAXID="123" IDENTIFICATIONNUMBER="456" CURRENTCREDITS="30" ENABLED="1" />
    <!--origin with id = 1 is an external - see RegistersDataSet.xml -->
    <BUSINESSUSER  ID="111111119" BUSINESSUSERDATA_ID="111111119" ORIGIN_ID="1" />
    <ADDRESS ID="10"  CITY_ID="211" STREET="Test street 10" ZIPCODE="60200" />
    <BUSINESSUSER_ADDRESS BUSINESSUSER_ID="111111119" ADDRESSES_ID="10" />
    <USERNOTIFICATION ID="111111119" SENT="2014-02-01 13:33:33" NOTIFICATION_ID="13" USER_ID="111111119" ENABLED="1"/>
    <!-- User in role client-->
    <BUSINESSUSERROLE ID="111111991" BUSINESSUSER_ID="111111119" ENABLED="1"/>
    <!-- User in role supplier-->
    <BUSINESSUSERROLE ID="111111992" BUSINESSUSER_ID="111111119" ENABLED="1"/>
    <CLIENT ID="111111991" />
    <SUPPLIER ID="111111992" />


    <!-- external user that has pending notification (older than 30 days) -->
    <USERT ID="111111199" EMAIL="imported9@email.com" PASSWORD="ktWVVhGwWiMsAVgfbIZmX96r5WXBwIzMcGzwUBVAXcFvtiJutGRbKOk58TfQ4Wr2"
           SETTINGS_ID="10" ENABLED="1" VERIFICATION="UNVERIFIED" />
    <USERT_ACCESSROLE USERT_ID="111111199" ACCESSROLES_ID="2" />
    <BUSINESSUSERDATA ID="111111199" COMPANYNAME="My Ninth Company" PERSONFIRSTNAME="Imported" PERSONLASTNAME="User99"
                      TAXID="12399" IDENTIFICATIONNUMBER="45699" CURRENTCREDITS="30" ENABLED="1" />
    <!--origin with id = 1 is an external - see RegistersDataSet.xml -->
    <BUSINESSUSER  ID="111111199" BUSINESSUSERDATA_ID="111111199" ORIGIN_ID="1" />
    <ADDRESS ID="11"  CITY_ID="211" STREET="Test street 11" ZIPCODE="60200" />
    <BUSINESSUSER_ADDRESS BUSINESSUSER_ID="111111199" ADDRESSES_ID="11" />
    <USERNOTIFICATION ID="111111199" SENT="2014-02-01 13:33:33" NOTIFICATION_ID="14" USER_ID="111111199" ENABLED="1"/>
    <!-- User in role client-->
    <BUSINESSUSERROLE ID="111111993" BUSINESSUSER_ID="111111199" ENABLED="1"/>
    <!-- User in role supplier-->
    <BUSINESSUSERROLE ID="111111994" BUSINESSUSER_ID="111111199" ENABLED="1"/>
    <CLIENT ID="111111993" />
    <SUPPLIER ID="111111994" />

    <!-- Potential Demand that matches external suppliers above -->
    <DEMAND ID="99" TYPE_ID="2" TITLE="Demand 99" DESCRIPTION="99: demand description for offered testing." PRICE="10000"
            STATUS="ACTIVE" CLIENT_ID="111111121" CREATEDDATE="2010-10-01 13:33:34"
            ENDDATE="2011-12-01 13:33:33" VALIDTO="2019-12-01 13:33:33" />
    <DEMANDTYPE ID="2" CODE="attractive" />
    <DEMAND_LOCALITY ID="99" DEMAND_ID="99" LOCALITY_ID="2" />  <!-- "locality2"-->
    <DEMAND_CATEGORY ID="99" DEMAND_ID="99" CATEGORY_ID="1132" /> <!-- "Category 1132" -->
    <MESSAGE ID="999"
             CREATED="2011-05-11"
             BODY="test for external supplier."
             PARENT_ID="[NULL]"
             SENDER_ID="111111112"
             FIRSTBORN_ID="[NULL]"
             THREADROOT_ID="999"
             SUBJECT="demand for externl supplier"
             DEMAND_ID="99" />
    <SUPPLIER_LOCALITY ID="990" SUPPLIER_ID="111111992" LOCALITY_ID="2" />
    <SUPPLIER_CATEGORY ID="990" SUPPLIER_ID="111111992" CATEGORY_ID="1132" />
    <SUPPLIER_LOCALITY ID="991" SUPPLIER_ID="111111994" LOCALITY_ID="2" />
    <SUPPLIER_CATEGORY ID="991" SUPPLIER_ID="111111994" CATEGORY_ID="1132" />

</dataset>