<!DOCTYPE dataset SYSTEM "../../../../../test.dtd">

<dataset>

    <SETTINGST ID="1" />
    <SETTINGST ID="2" />
    <SETTINGST ID="3" />
    <SETTINGST ID="4" />
    <SETTINGST ID="5" />
    <SETTINGST ID="6" />
    <SETTINGST ID="7" />
    <SETTINGST ID="8" />
    <SETTINGST ID="9" />

    <!-- Encrypted password corresponds to the "ahoj1" -->
    <USERT ID="111111111" EMAIL="elvira@email.com" PASSWORD="7xuGUhtNhAUbPEbU9YwZDoEceO1E45E/RWiELMGVCOm6QIDDVthJK/DJLqxKPfae"
           SETTINGS_ID="1" ENABLED="1" VERIFICATION="VERIFIED" />
    <USERT_ACCESSROLE USERT_ID="111111111" ACCESSROLES_ID="2" />
    <BUSINESSUSERDATA ID="111111111" COMPANYNAME="My First Company" PERSONFIRSTNAME="Elvíra" PERSONLASTNAME="Vytretá"
                      CURRENTCREDITS="30" ENABLED="1"/>
    <BUSINESSUSER  ID="111111111" BUSINESSUSERDATA_ID="111111111" />
    <ADDRESS ID="9"  CITY_ID="211" STREET="Test street 9" ZIPCODE="60200" />
    <BUSINESSUSER_ADDRESS BUSINESSUSER_ID="111111111" ADDRESSES_ID="9" />
    <!-- User in role client-->
    <BUSINESSUSERROLE ID="111111111" BUSINESSUSER_ID="111111111" ENABLED="1"/>
    <!-- User in role supplier-->
    <BUSINESSUSERROLE ID="111111112" BUSINESSUSER_ID="111111111" ENABLED="1"/>
    <CLIENT     ID="111111111" />
    <SUPPLIER   ID="111111112" OVERALRATING="0" />
    <NOTIFICATIONITEM ID="1" ENABLED="0" NOTIFICATION_ID="1" PERIOD="INSTANTLY" SETTINGS_ID="1" />
    <NOTIFICATIONITEM ID="12" ENABLED="0" NOTIFICATION_ID="2" PERIOD="INSTANTLY" SETTINGS_ID="1" />
    <NOTIFICATIONITEM ID="13" ENABLED="1" NOTIFICATION_ID="3" PERIOD="INSTANTLY" SETTINGS_ID="1" />
    <NOTIFICATIONITEM ID="14" ENABLED="0" NOTIFICATION_ID="6" PERIOD="INSTANTLY" SETTINGS_ID="1" />
    <NOTIFICATIONITEM ID="15" ENABLED="1" NOTIFICATION_ID="7" PERIOD="INSTANTLY" SETTINGS_ID="1" />

    <!-- Encrypted password corresponds to the "ahoj2" -->
    <USERT ID="111111112" EMAIL="velislav@email.com" PASSWORD="2ScrHmE5/qPHYSsYljrBNsMndlJLrvD5mWX+UkfTw2/GnAZsK77M6Cv9j9+WKNxB"
           SETTINGS_ID="2" ENABLED="1" VERIFICATION="UNVERIFIED" />
    <BUSINESSUSERDATA ID="111111112" COMPANYNAME="My Second Company" PERSONFIRSTNAME="Velislav" PERSONLASTNAME="Kroko"
                      CURRENTCREDITS="30" ENABLED="1"/>
    <BUSINESSUSER  ID="111111112" BUSINESSUSERDATA_ID="111111112"/>
    <BUSINESSUSERROLE ID="111111121" BUSINESSUSER_ID="111111112" ENABLED="1"/>
    <CLIENT ID="111111121" />

    <!-- Encrypted password corresponds to the "3ahoj" -->
    <USERT ID="111111113" EMAIL="lisohlavka@email.com" PASSWORD="U8j0x6agRuLmTUIUxpTMsb5uT+jDAQta/HzTgrQLesYqWVl5KsVw1NI5VKuAKeVn"
           SETTINGS_ID="3" ENABLED="1" VERIFICATION="VERIFIED" />
    <BUSINESSUSERDATA ID="111111113" COMPANYNAME="My Third Company" PERSONFIRSTNAME="Lisohlávka" PERSONLASTNAME="Čínska"
                      CURRENTCREDITS="30" ENABLED="1"/>
    <BUSINESSUSER ID="111111113" BUSINESSUSERDATA_ID="111111113"/>
    <!-- User in role supplier -->
    <BUSINESSUSERROLE ID="111111131" BUSINESSUSER_ID="111111113" ENABLED="1"/>
    <!-- User in role supplier -->
    <BUSINESSUSERROLE ID="111111132" BUSINESSUSER_ID="111111113" ENABLED="1"/>
    <CLIENT     ID="111111131" />
    <SUPPLIER   ID="111111132" OVERALRATING="0" />
    <NOTIFICATIONITEM ID="3" NOTIFICATION_ID="1" SETTINGS_ID="3" PERIOD="DAILY" ENABLED="1" />
    <NOTIFICATIONITEM ID="31" NOTIFICATION_ID="11" SETTINGS_ID="3" PERIOD="INSTANTLY" ENABLED="1" />

    <!-- Encrypted password corresponds to the "4ahoj" -->
    <USERT ID="111111114" EMAIL="elviraM@email.com" PASSWORD="ktWVVhGwWiMsAVgfbIZmX96r5WXBwIzMcGzwUBVAXcFvtiJutGRbKOk58TfQ4Wr2"
           SETTINGS_ID="4" ENABLED="1" VERIFICATION="UNVERIFIED" />
    <BUSINESSUSERDATA ID="111111114" COMPANYNAME="My Fourth Company" PERSONFIRSTNAME="Elvíra" PERSONLASTNAME="Maslová"
                      TAXID="hovna" IDENTIFICATIONNUMBER="sracky" ENABLED="1" CURRENTCREDITS="30"  />
    <BUSINESSUSER  ID="111111114" BUSINESSUSERDATA_ID="111111114" />
    <!-- User in role client -->
    <BUSINESSUSERROLE ID="111111141" BUSINESSUSER_ID="111111114" ENABLED="1"/>
    <!-- User in role supplier -->
    <BUSINESSUSERROLE ID="111111142" BUSINESSUSER_ID="111111114" ENABLED="1"/>
    <!-- User in role partner -->
    <BUSINESSUSERROLE ID="111111143" BUSINESSUSER_ID="111111114" ENABLED="1"/>
    <CLIENT     ID="111111141" />
    <SUPPLIER   ID="111111142" OVERALRATING="0" />
    <PARTNER    ID="111111143" />

    <!--Plaintext passwords should not be allowed!-->
    <USERT ID="111111115" EMAIL="elvira.plaintext.password@email.com" PASSWORD="ahoj1" SETTINGS_ID="5" ENABLED="1" VERIFICATION="UNVERIFIED" />
    <USERT_ACCESSROLE USERT_ID="111111115" ACCESSROLES_ID="3" />
    <BUSINESSUSERDATA ID="111111115" COMPANYNAME="My First Company" PERSONFIRSTNAME="Elvíra" PERSONLASTNAME="Vytretá"
                      CURRENTCREDITS="30" ENABLED="1"/>
    <BUSINESSUSER  ID="111111115" BUSINESSUSERDATA_ID="111111115" />
    <!-- User in role client-->
    <BUSINESSUSERROLE ID="111111151" BUSINESSUSER_ID="111111115" ENABLED="1"/>
    <!-- User in role supplier-->
    <BUSINESSUSERROLE ID="111111152" BUSINESSUSER_ID="111111115" ENABLED="1"/>
    <CLIENT     ID="111111151" />
    <SUPPLIER   ID="111111152" OVERALRATING="0" />


    <!--External (imported) users-->

    <!-- Encrypted password corresponds to the "4ahoj" -->
    <USERT ID="111111116" EMAIL="imported1@email.com" PASSWORD="ktWVVhGwWiMsAVgfbIZmX96r5WXBwIzMcGzwUBVAXcFvtiJutGRbKOk58TfQ4Wr2"
           SETTINGS_ID="6" ENABLED="1" VERIFICATION="UNVERIFIED" />
    <BUSINESSUSERDATA ID="111111116" COMPANYNAME="My Fourth Company" PERSONFIRSTNAME="Imported" PERSONLASTNAME="User1"
                      TAXID="123" IDENTIFICATIONNUMBER="456" ENABLED="1" CURRENTCREDITS="30" />
    <!--origin with id = 1 is an external - see RegistersDataSet.xml -->
    <BUSINESSUSER  ID="111111116" BUSINESSUSERDATA_ID="111111116" ORIGIN_ID="1" />

    <!-- external user that has already some notification -->
    <USERT ID="111111117" EMAIL="imported2@email.com" PASSWORD="ktWVVhGwWiMsAVgfbIZmX96r5WXBwIzMcGzwUBVAXcFvtiJutGRbKOk58TfQ4Wr2"
           SETTINGS_ID="7" ENABLED="1" VERIFICATION="UNVERIFIED" />
    <BUSINESSUSERDATA ID="111111117" COMPANYNAME="My Fourth Company" PERSONFIRSTNAME="Imported" PERSONLASTNAME="User2"
                      TAXID="123" IDENTIFICATIONNUMBER="456" ENABLED="1" CURRENTCREDITS="30" />
    <!--origin with id = 1 is an external - see RegistersDataSet.xml -->
    <BUSINESSUSER  ID="111111117" BUSINESSUSERDATA_ID="111111117" ORIGIN_ID="1" />

    <USERNOTIFICATION ID="111111117" SENT="2014-03-01 13:33:33" NOTIFICATION_ID="13" USER_ID="111111117" ENABLED="1"/>

    <!-- External user that is already verified -->
    <USERT ID="111111118" EMAIL="imported3@email.com" PASSWORD="ktWVVhGwWiMsAVgfbIZmX96r5WXBwIzMcGzwUBVAXcFvtiJutGRbKOk58TfQ4Wr2"
           SETTINGS_ID="8" ENABLED="1" VERIFICATION="VERIFIED" />
    <BUSINESSUSERDATA ID="111111118" COMPANYNAME="My Fourth Company" PERSONFIRSTNAME="Imported" PERSONLASTNAME="User3"
                      TAXID="123" IDENTIFICATIONNUMBER="456" ENABLED="1" CURRENTCREDITS="30" />
    <!--origin with id = 1 is an external - see RegistersDataSet.xml -->
    <BUSINESSUSER  ID="111111118" BUSINESSUSERDATA_ID="111111118" ORIGIN_ID="1" />


    <!-- external user that has pending notification (older than 30 days) -->
    <USERT ID="111111119" EMAIL="imported4@email.com" PASSWORD="ktWVVhGwWiMsAVgfbIZmX96r5WXBwIzMcGzwUBVAXcFvtiJutGRbKOk58TfQ4Wr2"
           SETTINGS_ID="9" ENABLED="1" VERIFICATION="UNVERIFIED" />
    <BUSINESSUSERDATA ID="111111119" COMPANYNAME="My Fourth Company" PERSONFIRSTNAME="Imported" PERSONLASTNAME="User2"
                      TAXID="123" IDENTIFICATIONNUMBER="456" ENABLED="1" CURRENTCREDITS="30" />
    <!--origin with id = 1 is an external - see RegistersDataSet.xml -->
    <BUSINESSUSER  ID="111111119" BUSINESSUSERDATA_ID="111111119" ORIGIN_ID="1" />

    <USERNOTIFICATION ID="111111119" SENT="2014-02-01 13:33:33" NOTIFICATION_ID="13" USER_ID="111111119" ENABLED="1"/>

</dataset>
