<!DOCTYPE dataset SYSTEM "../../../../../test.dtd">
<dataset >

    <!--############################################### localities ##################################################-->
    <!--
                                           CZ
                                    /           \
                                  loc1 1          loc2 2
                                /    \                  \
                             loc11 3   loc12 4             loc21 8
                           /   |          \         /     |     \       \
                     loc111   loc121    loc121  loc211  loc212 loc213 loc214

    -->
    <LOCALITY TYPE="COUNTRY" TREEID="111111" LEVEL="1" ID="0" NAME="Czech Republic" PARENT_ID="[NULL]" LEFTBOUND="1" RIGHTBOUND="24" />
    <LOCALITY TYPE="COUNTRY" TREEID="100" LEVEL="1" ID="100" NAME="Disabled country" PARENT_ID="[NULL]"
              LEFTBOUND="100" RIGHTBOUND="101" ENABLED="0"/>

    <LOCALITY TYPE="REGION" TREEID="1" LEVEL="2" ID="1" NAME="locality1" PARENT_ID="0" LEFTBOUND="2" RIGHTBOUND="11"/>
    <LOCALITY TYPE="REGION" TREEID="2" LEVEL="2" ID="2" NAME="locality2" PARENT_ID="0" LEFTBOUND="12" RIGHTBOUND="23"/>

    <!-- districts within first region -->
    <LOCALITY TYPE="DISTRICT" TREEID="8" LEVEL="3" ID="21" NAME="locality21" PARENT_ID="2" LEFTBOUND="13" RIGHTBOUND="22"/>
    <LOCALITY TYPE="DISTRICT" TREEID="3" LEVEL="3" ID="11" NAME="locality11" PARENT_ID="1" LEFTBOUND="3" RIGHTBOUND="6"/>
    <LOCALITY TYPE="DISTRICT" TREEID="4" LEVEL="3" ID="12" NAME="locality12" PARENT_ID="1" LEFTBOUND="7" RIGHTBOUND="10"/>

    <!-- cities for districts -->
    <LOCALITY TYPE="CITY" TREEID="9" LEVEL="4" ID="211" NAME="locality211" PARENT_ID="21" LEFTBOUND="14" RIGHTBOUND="15"/>
    <LOCALITY TYPE="CITY" TREEID="10" LEVEL="4" ID="212" NAME="locality212" PARENT_ID="21" LEFTBOUND="16" RIGHTBOUND="17"/>
    <LOCALITY TYPE="CITY" TREEID="11" LEVEL="4" ID="213" NAME="locality213" PARENT_ID="21" LEFTBOUND="18" RIGHTBOUND="19"/>
    <LOCALITY TYPE="CITY" TREEID="12" LEVEL="4" ID="214" NAME="locality214" PARENT_ID="21" LEFTBOUND="20" RIGHTBOUND="21"/>
    <LOCALITY TYPE="CITY" TREEID="5" LEVEL="4" ID="111" NAME="locality111" PARENT_ID="11" LEFTBOUND="4" RIGHTBOUND="5"/>
    <LOCALITY TYPE="CITY" TREEID="6" LEVEL="4" ID="121" NAME="locality121" PARENT_ID="12" LEFTBOUND="8" RIGHTBOUND="9"/>


    <!-- city for township - REMOVED -->
    <!-- <LOCALITY TYPE="CITY" TREEID="7" LEVEL="4" ID="1211" NAME="locality1211" PARENT_ID="1" LEFTBOUND="9" RIGHTBOUND="10"/> -->

</dataset>
