<!DOCTYPE dataset SYSTEM "../../../../../test.dtd">
<dataset>

    <SETTINGST ID="11" />
    <SETTINGST ID="12" />
    <SETTINGST ID="13" />
    <SETTINGST ID="14" />
    <SETTINGST ID="15" />

    <!--################################ Suppliers ##################################################################-->
    <USERT ID="11" EMAIL="elvira11@email.com" PASSWORD="ahoj" SETTINGS_ID="11" VERIFICATION="UNVERIFIED" />
    <BUSINESSUSERDATA ID="11" COMPANYNAME="My First Company" PERSONFIRSTNAME="Elvíra" PERSONLASTNAME="Vytretá"/>
    <BUSINESSUSER  ID="11" BUSINESSUSERDATA_ID="11"/>
    <BUSINESSUSERROLE ID="11" BUSINESSUSER_ID="11" />
    <CLIENT ID="11" />
    <SUPPLIER ID="11" />

    <USERT ID="12" EMAIL="velislav12@email.com" PASSWORD="ahoj" SETTINGS_ID="12" VERIFICATION="UNVERIFIED" />
    <BUSINESSUSERDATA ID="12" COMPANYNAME="My Second Company" PERSONFIRSTNAME="Velislav" PERSONLASTNAME="Kroko" />
    <BUSINESSUSER  ID="12" BUSINESSUSERDATA_ID="12"/>
    <BUSINESSUSERROLE ID="12" BUSINESSUSER_ID="12" />
    <CLIENT ID="12" />
    <SUPPLIER ID="12" />

    <USERT ID="13" EMAIL="lisohlavka12@email.com" PASSWORD="ahoj" SETTINGS_ID="13" VERIFICATION="UNVERIFIED" />
    <BUSINESSUSERDATA ID="13" COMPANYNAME="My Third Company" PERSONFIRSTNAME="Lisohlávka" PERSONLASTNAME="Čínska"/>
    <BUSINESSUSER ID="13" BUSINESSUSERDATA_ID="13"/>
    <BUSINESSUSERROLE ID="13" BUSINESSUSER_ID="13" />
    <CLIENT ID="13" />
    <SUPPLIER ID="13" />

    <USERT ID="14" EMAIL="elvira14@email.com" PASSWORD="ahoj" SETTINGS_ID="14" VERIFICATION="UNVERIFIED" />
    <BUSINESSUSERDATA ID="14" COMPANYNAME="My Fourth Company" TAXID="hovna" IDENTIFICATIONNUMBER="sracky" PERSONFIRSTNAME="Elvíra" PERSONLASTNAME="Maslová"/>
    <BUSINESSUSER  ID="14"  BUSINESSUSERDATA_ID="14" />
    <BUSINESSUSERROLE ID="14" BUSINESSUSER_ID="14" />
    <CLIENT ID="14" />
    <SUPPLIER ID="14" />

    <!-- User/BusinessUserRole-s with id=15 are disabled and shouldn't be involved in supplier related queries-->
    <USERT ID="15" EMAIL="importedSupplier15@email.com" PASSWORD="imported" SETTINGS_ID="15" VERIFICATION="UNVERIFIED" ENABLED="0" />
    <BUSINESSUSERDATA ID="15" COMPANYNAME="My Fifthe Company imported to WS" TAXID="123" IDENTIFICATIONNUMBER="12309892" PERSONFIRSTNAME="Ivan" PERSONLASTNAME="Importovany" ENABLED="0" />
    <BUSINESSUSER  ID="15"  BUSINESSUSERDATA_ID="15" />
    <BUSINESSUSERROLE ID="15" BUSINESSUSER_ID="15" ENABLED="0" />
    <CLIENT ID="15" ENABLED="0" />
    <SUPPLIER ID="15" ENABLED="0" />


    <!--################################ Suppliers to Localities#####################################################-->
    <!-- loc1 && loc213 -->
    <SUPPLIER_LOCALITY ID="1" SUPPLIER_ID="11" LOCALITY_ID="1" />
    <SUPPLIER_LOCALITY ID="2" SUPPLIER_ID="11" LOCALITY_ID="213" />

    <SUPPLIER_LOCALITY ID="3" SUPPLIER_ID="12" LOCALITY_ID="2" />
    <SUPPLIER_LOCALITY ID="4" SUPPLIER_ID="13" LOCALITY_ID="11" />
    <SUPPLIER_LOCALITY ID="5" SUPPLIER_ID="14" LOCALITY_ID="21" />
    <!-- supplier_locality id=10 is disabled and it shouldn't be involved in supplier related queries-->
    <SUPPLIER_LOCALITY ID="10" SUPPLIER_ID="15" LOCALITY_ID="21" ENABLED="0" />


    <!--################################ Suppliers to Categories#####################################################-->
    <SUPPLIER_CATEGORY ID="6" SUPPLIER_ID="11" CATEGORY_ID="3" />
    <SUPPLIER_CATEGORY ID="7" SUPPLIER_ID="12" CATEGORY_ID="11" />
    <SUPPLIER_CATEGORY ID="8" SUPPLIER_ID="13" CATEGORY_ID="113" />
    <SUPPLIER_CATEGORY ID="9" SUPPLIER_ID="14" CATEGORY_ID="312" />
    <!-- supplier_category id=11 is disabled and it shouldn't be involved in supplier related queries-->
    <SUPPLIER_CATEGORY ID="11" SUPPLIER_ID="15" CATEGORY_ID="312" ENABLED="0" />

</dataset>
