<!DOCTYPE dataset SYSTEM "../../../../../test.dtd">

<dataset>
    <!--############################################ demands ########################################################-->

    <DEMANDTYPE ID="1" CODE="normal" />
    <DEMANDTYPE ID="2" CODE="attractive" />
    <DEMANDTYPE ID="3" CODE="all" />

    <DEMAND ID="1" TYPE_ID="1" TITLE="Demand 1" DESCRIPTION="1: Normal request for java application."        PRICE="10000"
            STATUS="NEW" RATING_ID="1" CLIENT_ID="111111121" CREATEDDATE="2011-11-01 13:33:33"
            ENDDATE="2011-12-01 13:33:33" VALIDTO="2011-12-01 13:33:33" />
    <DEMAND ID="2" TYPE_ID="2" TITLE="Demand 2" DESCRIPTION="2: Attractive request for java application."    PRICE="10000"
            STATUS="ACTIVE" RATING_ID="2" CLIENT_ID="111111121" CREATEDDATE="2011-11-02 00:00:01"
            ENDDATE="2011-12-01 13:33:33" VALIDTO="2011-12-01 13:33:33" />
    <DEMAND ID="3" TYPE_ID="1" TITLE="Demand 3" DESCRIPTION="3: All request for java application."           PRICE="1200"
            STATUS="INVALID" RATING_ID="3" CLIENT_ID="111111131" CREATEDDATE="2001-01-01 00:00:01"
            ENDDATE="2011-12-01 13:33:33" VALIDTO="2011-12-01 13:33:33" />
    <DEMAND ID="4" TYPE_ID="1" TITLE="Demand 4" DESCRIPTION="4: Normal request for java application."
            STATUS="INVALID" RATING_ID="4" CLIENT_ID="111111141" CREATEDDATE="2001-01-01 00:00:01"
            ENDDATE="2011-12-01 13:33:33" VALIDTO="2011-12-01 13:33:33" />
    <DEMAND ID="5" TYPE_ID="2" TITLE="Demand 5" DESCRIPTION="5: Attractive request for java application."
            STATUS="INVALID"                                                  CREATEDDATE="2010-10-01 13:33:33"
            ENDDATE="2011-12-01 13:33:33" VALIDTO="2011-12-01 13:33:33" />
    <DEMAND ID="6" TYPE_ID="1" TITLE="Demand 6" DESCRIPTION="6: All request for java application."           PRICE="444"
            STATUS="INVALID" CREATEDDATE="2001-01-01 00:00:01"
            ENDDATE="2011-12-01 13:33:33" VALIDTO="2011-12-01 13:33:33" />
    <DEMAND ID="7" TYPE_ID="1" TITLE="Demand 7" DESCRIPTION="7: Normal request for java application."        PRICE="1110"
            STATUS="NEW" CREATEDDATE="2001-01-01 00:00:01"
            ENDDATE="2011-12-01 13:33:33" VALIDTO="2011-12-01 13:33:33" />
    <DEMAND ID="8" TYPE_ID="1" TITLE="Demand 8" DESCRIPTION="8: Normal request for java application."        PRICE="9000000"
            STATUS="ACTIVE" CREATEDDATE="2001-01-01 00:00:01" CLIENT_ID="111111141"
            ENDDATE="2011-12-01 13:33:33" VALIDTO="2011-12-01 13:33:33" />
    <!--demand with id 18 is the same as with id 8 bus has status NEW -->
    <DEMAND ID="18" TYPE_ID="1" TITLE="Demand 8" DESCRIPTION="8: Normal request for java application."        PRICE="9000000"
            STATUS="NEW" CREATEDDATE="2001-01-01 00:00:01"
            ENDDATE="2011-12-01 13:33:33" VALIDTO="2011-12-01 13:33:33" />
    <DEMAND ID="9" TYPE_ID="1" TITLE="Demand 9" DESCRIPTION="9: Normal request for java application." PRICE="10000"
            STATUS="ACTIVE" CREATEDDATE="2001-01-01 00:00:01" CLIENT_ID="111111121"
            ENDDATE="2011-12-01 13:33:33" VALIDTO="2011-12-01 13:33:33" />
    <DEMAND ID="10" TYPE_ID="2" TITLE="Demand 10" DESCRIPTION="10: Attractive request for java application." PRICE="10000"
            STATUS="ACTIVE" CREATEDDATE="2010-10-01 13:33:34" CLIENT_ID="111111121"
            ENDDATE="2011-12-01 13:33:33" VALIDTO="2011-12-01 13:33:33" />
    <DEMAND ID="11" TYPE_ID="2" TITLE="Demand 11" DESCRIPTION="11: want something from want-something.com." PRICE="10000"
            STATUS="CLOSED" CLIENT_ID="111111151" CREATEDDATE="2010-10-01 13:33:34"
            ENDDATE="2011-12-01 13:33:33" VALIDTO="2011-12-01 13:33:33" />

    <DEMAND ID="21" TYPE_ID="1" TITLE="Demand 9" DESCRIPTION="21: Normal request for java application."
            STATUS="ACTIVE" CREATEDDATE="2001-01-01 00:00:01" CLIENT_ID="111111121"
            ENDDATE="2011-12-01 13:33:33" VALIDTO="2011-12-01 13:33:33" />
    <DEMAND ID="22" TYPE_ID="2" TITLE="Demand 10" DESCRIPTION="22: Attractive request for java application." PRICE="10000"
            STATUS="OFFERED" CREATEDDATE="2010-10-01 13:33:34" CLIENT_ID="111111121"
            ENDDATE="2011-12-01 13:33:33" VALIDTO="2011-12-01 13:33:33" />
    <DEMAND ID="23" TYPE_ID="2" TITLE="Demand 11" DESCRIPTION="23: want something from want-something.com." PRICE="10000"
            STATUS="CLOSED" CLIENT_ID="111111121" CREATEDDATE="2010-10-01 13:33:34"
            ENDDATE="2011-12-01 13:33:33" VALIDTO="2011-12-01 13:33:33" />
    <DEMAND ID="70" TYPE_ID="2" TITLE="Demand 70" DESCRIPTION="70: demand description for offered testing." PRICE="10000"
            STATUS="OFFERED" CLIENT_ID="111111121" CREATEDDATE="2010-10-01 13:33:34"
            ENDDATE="2011-12-01 13:33:33" VALIDTO="2011-12-01 13:33:33" />



    <!--########################################## demands for localities ###########################################-->
    <DEMAND_LOCALITY ID="1" DEMAND_ID="1" LOCALITY_ID="1" />   <!-- "locality1"-->
    <DEMAND_LOCALITY ID="2" DEMAND_ID="2" LOCALITY_ID="2" />   <!-- "locality2"-->
    <DEMAND_LOCALITY ID="3" DEMAND_ID="3" LOCALITY_ID="2" />   <!-- "locality2"-->
    <DEMAND_LOCALITY ID="4" DEMAND_ID="4" LOCALITY_ID="11" />   <!-- "locality11"-->
    <DEMAND_LOCALITY ID="5" DEMAND_ID="5" LOCALITY_ID="11" />   <!-- "locality11"-->
    <DEMAND_LOCALITY ID="6" DEMAND_ID="6" LOCALITY_ID="11" />   <!-- "locality11"-->
    <DEMAND_LOCALITY ID="7" DEMAND_ID="7" LOCALITY_ID="11" />   <!-- "locality11"-->
    <DEMAND_LOCALITY ID="8" DEMAND_ID="8" LOCALITY_ID="121" />   <!-- "locality121"-->
    <DEMAND_LOCALITY ID="18" DEMAND_ID="18" LOCALITY_ID="121" />   <!-- "locality121"-->
    <DEMAND_LOCALITY ID="9" DEMAND_ID="9" LOCALITY_ID="21" />   <!-- "locality21"-->
    <DEMAND_LOCALITY ID="10" DEMAND_ID="10" LOCALITY_ID="2" />  <!-- "locality2"-->
    <DEMAND_LOCALITY ID="11" DEMAND_ID="11" LOCALITY_ID="2" />  <!-- "locality2"-->

    <!--########################################## demands for categories ###########################################-->
    <DEMAND_CATEGORY ID="1" DEMAND_ID="1" CATEGORY_ID="0" /> <!-- "Root category" -->
    <DEMAND_CATEGORY ID="2" DEMAND_ID="2" CATEGORY_ID="1" /> <!-- "Category 1" -->
    <DEMAND_CATEGORY ID="3" DEMAND_ID="3" CATEGORY_ID="2" /> <!-- "Category 2" -->
    <DEMAND_CATEGORY ID="4" DEMAND_ID="4" CATEGORY_ID="3" /> <!-- "Category 3" -->
    <DEMAND_CATEGORY ID="5" DEMAND_ID="5" CATEGORY_ID="11" /> <!-- "Category 11" -->
    <DEMAND_CATEGORY ID="6" DEMAND_ID="6" CATEGORY_ID="11" /> <!-- "Category 11" -->
    <DEMAND_CATEGORY ID="7" DEMAND_ID="7" CATEGORY_ID="31" /> <!-- "Category 31" -->
    <DEMAND_CATEGORY ID="8" DEMAND_ID="8" CATEGORY_ID="112" /> <!-- "Category 112" -->
    <DEMAND_CATEGORY ID="18" DEMAND_ID="18" CATEGORY_ID="112" /> <!-- "Category 112" -->
    <DEMAND_CATEGORY ID="9" DEMAND_ID="9" CATEGORY_ID="312" /> <!-- "Category 312" -->
    <DEMAND_CATEGORY ID="10" DEMAND_ID="10" CATEGORY_ID="1132" /> <!-- "Category 1132" -->
    <DEMAND_CATEGORY ID="11" DEMAND_ID="11" CATEGORY_ID="1132" /> <!-- "Category 1132" -->

</dataset>
